{
  "schema_version": "secret-0002-session-open-0.1",
  "artifact_id": "open.signing.20260415.001",
  "session_id": "session.req.signing.20260412.001",
  "bridge_trace": "trace.signing.20260412.001",
  "action": "open",
  "credential_family": "tempo-session",
  "decision": "allow",
  "transaction": {
    "encoding": "0x-prefixed-hex",
    "value": "0x02f9017c82021080843b9aca0084773594008302bf2094f39fd6e51aad88f6f4ce6ab8827279cfffb9226680b901040102030405060708090a0b0c0d0e0f101112131415161718191a1b1c1d1e1f202122232425262728292a2b2c2d2e2f303132333435363738393a3b3c3d3e3f404142434445464748494a4b4c4d4e4f505152535455565758595a5b5c5d5e5f606162636465666768696a6b6c6d6e6f707172737475767778797a7b7c7d7e7f80c080a0aaaaaaaaaaaaaaaaaaaaaaaaaaaaaaaaaaaaaaaaaaaaaaaaaaaaaaaaaaaaaaa0bbbbbbbbbbbbbbbbbbbbbbbbbbbbbbbbbbbbbbbbbbbbbbbbbbbbbbbbbbbbbbbb"
  },
  "channel": {
    "channel_id": "tempo-channel-20260415-001",
    "derivation": "transaction-bound"
  },
  "voucher": {
    "cumulative_amount": "0",
    "signature": {
      "format": "hex-65",
      "value": "0xcccccccccccccccccccccccccccccccccccccccccccccccccccccccccccccccccccccccccccccccccccccccccccccccccccccccccccccccccccccccccccccccccc"
    }
  },
  "signer_identity": {
    "address": "0x773c1778758fAa5dcC5caE55a69a125D8085Ff29",
    "key_ref": "hsmop://secret.signing.release-artifact/req.signing.20260412.001"
  }
}
